{
  "schema_version": 1,
  "regime": "ASVS",
  "version": "v5.0.0",
  "title": "OWASP Application Security Verification Standard",
  "short_title": "ASVS",
  "description": "Application security verification requirements for web applications and APIs.",
  "ruleset_ref": {
    "ruleset": "ASVS",
    "version": "v5.0.0",
    "path": "resources/rulesets/asvs/5.0.0.json"
  },
  "source": {
    "url": "https://github.com/OWASP/ASVS/tree/v5.0.0",
    "license": "CC-BY-SA-4.0",
    "publisher": "OWASP",
    "retrieved_at": "2026-07-03T06:48:28Z",
    "source_file": "resources/compliance-regimes/asvs/v5.0.0.json"
  },
  "family_axis": {
    "label": "chapter",
    "row_field": "group",
    "ui_label": "Chapter / family"
  },
  "families": [
    {"id": "V1", "title": "Encoding and Injection Prevention"},
    {"id": "V2", "title": "Authentication"},
    {"id": "V3", "title": "Session Management"},
    {"id": "V4", "title": "Access Control"},
    {"id": "V5", "title": "Validation, Sanitization and Encoding"},
    {"id": "V6", "title": "Stored Cryptography"},
    {"id": "V7", "title": "Error Handling and Logging"},
    {"id": "V8", "title": "Data Protection"},
    {"id": "V9", "title": "Communications"},
    {"id": "V10", "title": "Malicious Code"},
    {"id": "V11", "title": "Business Logic"},
    {"id": "V12", "title": "File and Resources"},
    {"id": "V13", "title": "API and Web Service"},
    {"id": "V14", "title": "Configuration"},
    {"id": "V15", "title": "Requirements"},
    {"id": "V16", "title": "Architecture"},
    {"id": "V17", "title": "Supply Chain"}
  ],
  "applicability": {
    "default_scope": "web_application_and_api",
    "notes": [
      "Use as a compliance regime when the project requires application security verification.",
      "FR/TBT mappings remain project-specific and must be accepted through reviewed config."
    ]
  },
  "proof": {
    "commitment_role": "compliance_regime",
    "zk_disclosure": "May be disclosed as public metadata with a hash commitment to the exact ruleset snapshot."
  }
}
